<?xml version="1.0"?>
<?xml-stylesheet type="text/xsl" href="pdml2html.xsl"?>
<!-- You can find pdml2html.xsl in /usr/share/wireshark or at https://code.wireshark.org/review/gitweb?p=wireshark.git;a=blob_plain;f=pdml2html.xsl. -->
<pdml version="0" creator="wireshark/2.2.4" time="Tue Feb 21 16:57:24 2017" capture_file="t1.pcapng">
<packet>
  <proto name="geninfo" pos="0" showname="General information" size="64">
    <field name="num" pos="0" show="285" showname="Number" value="11d" size="64"/>
    <field name="len" pos="0" show="64" showname="Frame Length" value="40" size="64"/>
    <field name="caplen" pos="0" show="64" showname="Captured Length" value="40" size="64"/>
    <field name="timestamp" pos="0" show="Oct  4, 2016 14:38:05.010083000 EDT" showname="Captured Time" value="1475606285.010083000" size="64"/>
  </proto>
  <proto name="frame" showname="Frame 285: 64 bytes on wire (512 bits), 64 bytes captured (512 bits) on interface 0" size="64" pos="0">
    <field name="frame.interface_id" showname="Interface id: 0 (any)" size="0" pos="0" show="0"/>
    <field name="frame.encap_type" showname="Encapsulation type: Linux cooked-mode capture (25)" size="0" pos="0" show="25"/>
    <field name="frame.time" showname="Arrival Time: Oct  4, 2016 14:38:05.010083000 EDT" size="0" pos="0" show="Oct  4, 2016 14:38:05.010083000 EDT"/>
    <field name="frame.offset_shift" showname="Time shift for this packet: 0.000000000 seconds" size="0" pos="0" show="0.000000000"/>
    <field name="frame.time_epoch" showname="Epoch Time: 1475606285.010083000 seconds" size="0" pos="0" show="1475606285.010083000"/>
    <field name="frame.time_delta" showname="Time delta from previous captured frame: 0.000070000 seconds" size="0" pos="0" show="0.000070000"/>
    <field name="frame.time_delta_displayed" showname="Time delta from previous displayed frame: 0.000000000 seconds" size="0" pos="0" show="0.000000000"/>
    <field name="frame.time_relative" showname="Time since reference or first frame: 4.220406000 seconds" size="0" pos="0" show="4.220406000"/>
    <field name="frame.number" showname="Frame Number: 285" size="0" pos="0" show="285"/>
    <field name="frame.len" showname="Frame Length: 64 bytes (512 bits)" size="0" pos="0" show="64"/>
    <field name="frame.cap_len" showname="Capture Length: 64 bytes (512 bits)" size="0" pos="0" show="64"/>
    <field name="frame.marked" showname="Frame is marked: False" size="0" pos="0" show="0"/>
    <field name="frame.ignored" showname="Frame is ignored: False" size="0" pos="0" show="0"/>
    <field name="frame.protocols" showname="Protocols in frame: sll:ethertype:ip:tcp:amqp" size="0" pos="0" show="sll:ethertype:ip:tcp:amqp"/>
  </proto>
  <proto name="sll" showname="Linux cooked capture" size="16" pos="0">
    <field name="sll.pkttype" showname="Packet type: Unicast to us (0)" size="2" pos="0" show="0" value="0000"/>
    <field name="sll.hatype" showname="Link-layer address type: 65534" size="2" pos="2" show="65534" value="fffe"/>
    <field name="sll.halen" showname="Link-layer address length: 0" size="2" pos="4" show="0" value="0000"/>
    <field name="sll.etype" showname="Protocol: IPv4 (0x0800)" size="2" pos="14" show="0x00000800" value="0800"/>
  </proto>
  <proto name="ip" showname="Internet Protocol Version 4, Src: 10.18.96.1, Dst: 10.10.62.244" size="20" pos="16">
    <field name="ip.version" showname="0100 .... = Version: 4" size="1" pos="16" show="4" value="4" unmaskedvalue="45"/>
    <field name="ip.hdr_len" showname=".... 0101 = Header Length: 20 bytes (5)" size="1" pos="16" show="20" value="45"/>
    <field name="ip.dsfield" showname="Differentiated Services Field: 0x00 (DSCP: CS0, ECN: Not-ECT)" size="1" pos="17" show="0x00000000" value="00">
      <field name="ip.dsfield.dscp" showname="0000 00.. = Differentiated Services Codepoint: Default (0)" size="1" pos="17" show="0" value="0" unmaskedvalue="00"/>
      <field name="ip.dsfield.ecn" showname=".... ..00 = Explicit Congestion Notification: Not ECN-Capable Transport (0)" size="1" pos="17" show="0" value="0" unmaskedvalue="00"/>
    </field>
    <field name="ip.len" showname="Total Length: 48" size="2" pos="18" show="48" value="0030"/>
    <field name="ip.id" showname="Identification: 0x6ac6 (27334)" size="2" pos="20" show="0x00006ac6" value="6ac6"/>
    <field name="ip.flags" showname="Flags: 0x02 (Don&#x27;t Fragment)" size="1" pos="22" show="0x00000002" value="40">
      <field name="ip.flags.rb" showname="0... .... = Reserved bit: Not set" size="1" pos="22" show="0" value="40"/>
      <field name="ip.flags.df" showname=".1.. .... = Don&#x27;t fragment: Set" size="1" pos="22" show="1" value="40"/>
      <field name="ip.flags.mf" showname="..0. .... = More fragments: Not set" size="1" pos="22" show="0" value="40"/>
    </field>
    <field name="ip.frag_offset" showname="Fragment offset: 0" size="2" pos="22" show="0" value="4000"/>
    <field name="ip.ttl" showname="Time to live: 124" size="1" pos="24" show="124" value="7c"/>
    <field name="ip.proto" showname="Protocol: TCP (6)" size="1" pos="25" show="6" value="06"/>
    <field name="ip.checksum" showname="Header checksum: 0xe0f0 [validation disabled]" size="2" pos="26" show="0x0000e0f0" value="e0f0"/>
    <field name="ip.checksum.status" showname="Header checksum status: Unverified" size="0" pos="26" show="2"/>
    <field name="ip.src" showname="Source: 10.18.96.1" size="4" pos="28" show="10.18.96.1" value="0a126001"/>
    <field name="ip.addr" showname="Source or Destination Address: 10.18.96.1" size="4" pos="28" show="10.18.96.1" value="0a126001"/>
    <field name="ip.src_host" showname="Source Host: 10.18.96.1" size="4" pos="28" show="10.18.96.1" value="0a126001"/>
    <field name="ip.host" showname="Source or Destination Host: 10.18.96.1" size="4" pos="28" show="10.18.96.1" value="0a126001"/>
    <field name="ip.dst" showname="Destination: 10.10.62.244" size="4" pos="32" show="10.10.62.244" value="0a0a3ef4"/>
    <field name="ip.addr" showname="Source or Destination Address: 10.10.62.244" size="4" pos="32" show="10.10.62.244" value="0a0a3ef4"/>
    <field name="ip.dst_host" showname="Destination Host: 10.10.62.244" size="4" pos="32" show="10.10.62.244" value="0a0a3ef4"/>
    <field name="ip.host" showname="Source or Destination Host: 10.10.62.244" size="4" pos="32" show="10.10.62.244" value="0a0a3ef4"/>
    <field name="" show="Source GeoIP: Unknown" size="4" pos="28" value="0a126001"/>
    <field name="" show="Destination GeoIP: Unknown" size="4" pos="32" value="0a0a3ef4"/>
  </proto>
  <proto name="tcp" showname="Transmission Control Protocol, Src Port: 57031, Dst Port: 5672, Seq: 1, Ack: 1, Len: 8" size="20" pos="36">
    <field name="tcp.srcport" showname="Source Port: 57031" size="2" pos="36" show="57031" value="dec7"/>
    <field name="tcp.dstport" showname="Destination Port: 5672" size="2" pos="38" show="5672" value="1628"/>
    <field name="tcp.port" showname="Source or Destination Port: 57031" size="2" pos="36" show="57031" value="dec7"/>
    <field name="tcp.port" showname="Source or Destination Port: 5672" size="2" pos="38" show="5672" value="1628"/>
    <field name="tcp.stream" showname="Stream index: 4" size="0" pos="36" show="4"/>
    <field name="tcp.len" showname="TCP Segment Len: 8" size="1" pos="48" show="8" value="50"/>
    <field name="tcp.seq" showname="Sequence number: 1    (relative sequence number)" size="4" pos="40" show="1" value="16fa0147"/>
    <field name="tcp.nxtseq" showname="Next sequence number: 9    (relative sequence number)" size="0" pos="36" show="9"/>
    <field name="tcp.ack" showname="Acknowledgment number: 1    (relative ack number)" size="4" pos="44" show="1" value="fcf2270e"/>
    <field name="tcp.hdr_len" showname="Header Length: 20 bytes" size="1" pos="48" show="20" value="50"/>
    <field name="tcp.flags" showname="Flags: 0x018 (PSH, ACK)" size="2" pos="48" show="0x00000018" value="18" unmaskedvalue="5018">
      <field name="tcp.flags.res" showname="000. .... .... = Reserved: Not set" size="1" pos="48" show="0" value="0" unmaskedvalue="50"/>
      <field name="tcp.flags.ns" showname="...0 .... .... = Nonce: Not set" size="1" pos="48" show="0" value="0" unmaskedvalue="50"/>
      <field name="tcp.flags.cwr" showname=".... 0... .... = Congestion Window Reduced (CWR): Not set" size="1" pos="49" show="0" value="0" unmaskedvalue="18"/>
      <field name="tcp.flags.ecn" showname=".... .0.. .... = ECN-Echo: Not set" size="1" pos="49" show="0" value="0" unmaskedvalue="18"/>
      <field name="tcp.flags.urg" showname=".... ..0. .... = Urgent: Not set" size="1" pos="49" show="0" value="0" unmaskedvalue="18"/>
      <field name="tcp.flags.ack" showname=".... ...1 .... = Acknowledgment: Set" size="1" pos="49" show="1" value="1" unmaskedvalue="18"/>
      <field name="tcp.flags.push" showname=".... .... 1... = Push: Set" size="1" pos="49" show="1" value="1" unmaskedvalue="18"/>
      <field name="tcp.flags.reset" showname=".... .... .0.. = Reset: Not set" size="1" pos="49" show="0" value="0" unmaskedvalue="18"/>
      <field name="tcp.flags.syn" showname=".... .... ..0. = Syn: Not set" size="1" pos="49" show="0" value="0" unmaskedvalue="18"/>
      <field name="tcp.flags.fin" showname=".... .... ...0 = Fin: Not set" size="1" pos="49" show="0" value="0" unmaskedvalue="18"/>
      <field name="tcp.flags.str" showname="TCP Flags: \xc2\xb7\xc2\xb7\xc2\xb7\xc2\xb7\xc2\xb7\xc2\xb7\xc2\xb7AP\xc2\xb7\xc2\xb7\xc2\xb7" size="2" pos="48" show="\xc2\xb7\xc2\xb7\xc2\xb7\xc2\xb7\xc2\xb7\xc2\xb7\xc2\xb7AP\xc2\xb7\xc2\xb7\xc2\xb7" value="5018"/>
    </field>
    <field name="tcp.window_size_value" showname="Window size value: 258" size="2" pos="50" show="258" value="0102"/>
    <field name="tcp.window_size" showname="Calculated window size: 66048" size="2" pos="50" show="66048" value="0102"/>
    <field name="tcp.window_size_scalefactor" showname="Window size scaling factor: 256" size="2" pos="50" show="256" value="0102"/>
    <field name="tcp.checksum" showname="Checksum: 0x37e1 [unverified]" size="2" pos="52" show="0x000037e1" value="37e1"/>
    <field name="tcp.checksum.status" showname="Checksum Status: Unverified" size="0" pos="52" show="2"/>
    <field name="tcp.urgent_pointer" showname="Urgent pointer: 0" size="2" pos="54" show="0" value="0000"/>
    <field name="tcp.analysis" showname="SEQ/ACK analysis" size="0" pos="36" show="" value="">
      <field name="tcp.analysis.initial_rtt" showname="iRTT: 0.067216000 seconds" size="0" pos="36" show="0.067216000"/>
      <field name="tcp.analysis.bytes_in_flight" showname="Bytes in flight: 8" size="0" pos="36" show="8"/>
      <field name="tcp.analysis.push_bytes_sent" showname="Bytes sent since last PSH flag: 8" size="0" pos="36" show="8"/>
    </field>
    <field name="tcp.pdu.size" showname="PDU Size: 8" size="8" pos="56" show="8" value="414d515000010000"/>
  </proto>
  <proto name="amqp" showname="Advanced Message Queueing Protocol" size="8" pos="56">
    <field name="amqp.init.protocol" showname="Protocol: AMQP" size="4" pos="56" show="AMQP" value="414d5150"/>
    <field name="amqp.init.id" showname="Protocol-ID: 0" size="1" pos="60" show="0" value="00"/>
    <field name="amqp.init.version_major" showname="Version Major: 1" size="1" pos="61" show="1" value="01"/>
    <field name="amqp.init.version_minor" showname="Version Minor: 0" size="1" pos="62" show="0" value="00"/>
    <field name="amqp.init.version_revision" showname="Version-Revision: 0" size="1" pos="63" show="0" value="00"/>
  </proto>
</packet>


<packet>
  <proto name="geninfo" pos="0" showname="General information" size="130">
    <field name="num" pos="0" show="290" showname="Number" value="122" size="130"/>
    <field name="len" pos="0" show="130" showname="Frame Length" value="82" size="130"/>
    <field name="caplen" pos="0" show="130" showname="Captured Length" value="82" size="130"/>
    <field name="timestamp" pos="0" show="Oct  4, 2016 14:38:05.017369000 EDT" showname="Captured Time" value="1475606285.017369000" size="130"/>
  </proto>
  <proto name="frame" showname="Frame 290: 130 bytes on wire (1040 bits), 130 bytes captured (1040 bits) on interface 0" size="130" pos="0">
    <field name="frame.interface_id" showname="Interface id: 0 (any)" size="0" pos="0" show="0"/>
    <field name="frame.encap_type" showname="Encapsulation type: Linux cooked-mode capture (25)" size="0" pos="0" show="25"/>
    <field name="frame.time" showname="Arrival Time: Oct  4, 2016 14:38:05.017369000 EDT" size="0" pos="0" show="Oct  4, 2016 14:38:05.017369000 EDT"/>
    <field name="frame.offset_shift" showname="Time shift for this packet: 0.000000000 seconds" size="0" pos="0" show="0.000000000"/>
    <field name="frame.time_epoch" showname="Epoch Time: 1475606285.017369000 seconds" size="0" pos="0" show="1475606285.017369000"/>
    <field name="frame.time_delta" showname="Time delta from previous captured frame: 0.000113000 seconds" size="0" pos="0" show="0.000113000"/>
    <field name="frame.time_delta_displayed" showname="Time delta from previous displayed frame: 0.007286000 seconds" size="0" pos="0" show="0.007286000"/>
    <field name="frame.time_relative" showname="Time since reference or first frame: 4.227692000 seconds" size="0" pos="0" show="4.227692000"/>
    <field name="frame.number" showname="Frame Number: 290" size="0" pos="0" show="290"/>
    <field name="frame.len" showname="Frame Length: 130 bytes (1040 bits)" size="0" pos="0" show="130"/>
    <field name="frame.cap_len" showname="Capture Length: 130 bytes (1040 bits)" size="0" pos="0" show="130"/>
    <field name="frame.marked" showname="Frame is marked: False" size="0" pos="0" show="0"/>
    <field name="frame.ignored" showname="Frame is ignored: False" size="0" pos="0" show="0"/>
    <field name="frame.protocols" showname="Protocols in frame: sll:ethertype:ip:tcp:amqp" size="0" pos="0" show="sll:ethertype:ip:tcp:amqp"/>
  </proto>
  <proto name="sll" showname="Linux cooked capture" size="16" pos="0">
    <field name="sll.pkttype" showname="Packet type: Unicast to us (0)" size="2" pos="0" show="0" value="0000"/>
    <field name="sll.hatype" showname="Link-layer address type: 65534" size="2" pos="2" show="65534" value="fffe"/>
    <field name="sll.halen" showname="Link-layer address length: 0" size="2" pos="4" show="0" value="0000"/>
    <field name="sll.etype" showname="Protocol: IPv4 (0x0800)" size="2" pos="14" show="0x00000800" value="0800"/>
  </proto>
  <proto name="ip" showname="Internet Protocol Version 4, Src: 10.18.96.1, Dst: 10.10.62.244" size="20" pos="16">
    <field name="ip.version" showname="0100 .... = Version: 4" size="1" pos="16" show="4" value="4" unmaskedvalue="45"/>
    <field name="ip.hdr_len" showname=".... 0101 = Header Length: 20 bytes (5)" size="1" pos="16" show="20" value="45"/>
    <field name="ip.dsfield" showname="Differentiated Services Field: 0x00 (DSCP: CS0, ECN: Not-ECT)" size="1" pos="17" show="0x00000000" value="00">
      <field name="ip.dsfield.dscp" showname="0000 00.. = Differentiated Services Codepoint: Default (0)" size="1" pos="17" show="0" value="0" unmaskedvalue="00"/>
      <field name="ip.dsfield.ecn" showname=".... ..00 = Explicit Congestion Notification: Not ECN-Capable Transport (0)" size="1" pos="17" show="0" value="0" unmaskedvalue="00"/>
    </field>
    <field name="ip.len" showname="Total Length: 114" size="2" pos="18" show="114" value="0072"/>
    <field name="ip.id" showname="Identification: 0x6ac7 (27335)" size="2" pos="20" show="0x00006ac7" value="6ac7"/>
    <field name="ip.flags" showname="Flags: 0x02 (Don&#x27;t Fragment)" size="1" pos="22" show="0x00000002" value="40">
      <field name="ip.flags.rb" showname="0... .... = Reserved bit: Not set" size="1" pos="22" show="0" value="40"/>
      <field name="ip.flags.df" showname=".1.. .... = Don&#x27;t fragment: Set" size="1" pos="22" show="1" value="40"/>
      <field name="ip.flags.mf" showname="..0. .... = More fragments: Not set" size="1" pos="22" show="0" value="40"/>
    </field>
    <field name="ip.frag_offset" showname="Fragment offset: 0" size="2" pos="22" show="0" value="4000"/>
    <field name="ip.ttl" showname="Time to live: 124" size="1" pos="24" show="124" value="7c"/>
    <field name="ip.proto" showname="Protocol: TCP (6)" size="1" pos="25" show="6" value="06"/>
    <field name="ip.checksum" showname="Header checksum: 0xe0ad [validation disabled]" size="2" pos="26" show="0x0000e0ad" value="e0ad"/>
    <field name="ip.checksum.status" showname="Header checksum status: Unverified" size="0" pos="26" show="2"/>
    <field name="ip.src" showname="Source: 10.18.96.1" size="4" pos="28" show="10.18.96.1" value="0a126001"/>
    <field name="ip.addr" showname="Source or Destination Address: 10.18.96.1" size="4" pos="28" show="10.18.96.1" value="0a126001"/>
    <field name="ip.src_host" showname="Source Host: 10.18.96.1" size="4" pos="28" show="10.18.96.1" value="0a126001"/>
    <field name="ip.host" showname="Source or Destination Host: 10.18.96.1" size="4" pos="28" show="10.18.96.1" value="0a126001"/>
    <field name="ip.dst" showname="Destination: 10.10.62.244" size="4" pos="32" show="10.10.62.244" value="0a0a3ef4"/>
    <field name="ip.addr" showname="Source or Destination Address: 10.10.62.244" size="4" pos="32" show="10.10.62.244" value="0a0a3ef4"/>
    <field name="ip.dst_host" showname="Destination Host: 10.10.62.244" size="4" pos="32" show="10.10.62.244" value="0a0a3ef4"/>
    <field name="ip.host" showname="Source or Destination Host: 10.10.62.244" size="4" pos="32" show="10.10.62.244" value="0a0a3ef4"/>
    <field name="" show="Source GeoIP: Unknown" size="4" pos="28" value="0a126001"/>
    <field name="" show="Destination GeoIP: Unknown" size="4" pos="32" value="0a0a3ef4"/>
  </proto>
  <proto name="tcp" showname="Transmission Control Protocol, Src Port: 57031, Dst Port: 5672, Seq: 9, Ack: 1, Len: 74" size="20" pos="36">
    <field name="tcp.srcport" showname="Source Port: 57031" size="2" pos="36" show="57031" value="dec7"/>
    <field name="tcp.dstport" showname="Destination Port: 5672" size="2" pos="38" show="5672" value="1628"/>
    <field name="tcp.port" showname="Source or Destination Port: 57031" size="2" pos="36" show="57031" value="dec7"/>
    <field name="tcp.port" showname="Source or Destination Port: 5672" size="2" pos="38" show="5672" value="1628"/>
    <field name="tcp.stream" showname="Stream index: 4" size="0" pos="36" show="4"/>
    <field name="tcp.len" showname="TCP Segment Len: 74" size="1" pos="48" show="74" value="50"/>
    <field name="tcp.seq" showname="Sequence number: 9    (relative sequence number)" size="4" pos="40" show="9" value="16fa014f"/>
    <field name="tcp.nxtseq" showname="Next sequence number: 83    (relative sequence number)" size="0" pos="36" show="83"/>
    <field name="tcp.ack" showname="Acknowledgment number: 1    (relative ack number)" size="4" pos="44" show="1" value="fcf2270e"/>
    <field name="tcp.hdr_len" showname="Header Length: 20 bytes" size="1" pos="48" show="20" value="50"/>
    <field name="tcp.flags" showname="Flags: 0x018 (PSH, ACK)" size="2" pos="48" show="0x00000018" value="18" unmaskedvalue="5018">
      <field name="tcp.flags.res" showname="000. .... .... = Reserved: Not set" size="1" pos="48" show="0" value="0" unmaskedvalue="50"/>
      <field name="tcp.flags.ns" showname="...0 .... .... = Nonce: Not set" size="1" pos="48" show="0" value="0" unmaskedvalue="50"/>
      <field name="tcp.flags.cwr" showname=".... 0... .... = Congestion Window Reduced (CWR): Not set" size="1" pos="49" show="0" value="0" unmaskedvalue="18"/>
      <field name="tcp.flags.ecn" showname=".... .0.. .... = ECN-Echo: Not set" size="1" pos="49" show="0" value="0" unmaskedvalue="18"/>
      <field name="tcp.flags.urg" showname=".... ..0. .... = Urgent: Not set" size="1" pos="49" show="0" value="0" unmaskedvalue="18"/>
      <field name="tcp.flags.ack" showname=".... ...1 .... = Acknowledgment: Set" size="1" pos="49" show="1" value="1" unmaskedvalue="18"/>
      <field name="tcp.flags.push" showname=".... .... 1... = Push: Set" size="1" pos="49" show="1" value="1" unmaskedvalue="18"/>
      <field name="tcp.flags.reset" showname=".... .... .0.. = Reset: Not set" size="1" pos="49" show="0" value="0" unmaskedvalue="18"/>
      <field name="tcp.flags.syn" showname=".... .... ..0. = Syn: Not set" size="1" pos="49" show="0" value="0" unmaskedvalue="18"/>
      <field name="tcp.flags.fin" showname=".... .... ...0 = Fin: Not set" size="1" pos="49" show="0" value="0" unmaskedvalue="18"/>
      <field name="tcp.flags.str" showname="TCP Flags: \xc2\xb7\xc2\xb7\xc2\xb7\xc2\xb7\xc2\xb7\xc2\xb7\xc2\xb7AP\xc2\xb7\xc2\xb7\xc2\xb7" size="2" pos="48" show="\xc2\xb7\xc2\xb7\xc2\xb7\xc2\xb7\xc2\xb7\xc2\xb7\xc2\xb7AP\xc2\xb7\xc2\xb7\xc2\xb7" value="5018"/>
    </field>
    <field name="tcp.window_size_value" showname="Window size value: 258" size="2" pos="50" show="258" value="0102"/>
    <field name="tcp.window_size" showname="Calculated window size: 66048" size="2" pos="50" show="66048" value="0102"/>
    <field name="tcp.window_size_scalefactor" showname="Window size scaling factor: 256" size="2" pos="50" show="256" value="0102"/>
    <field name="tcp.checksum" showname="Checksum: 0x7f58 [unverified]" size="2" pos="52" show="0x00007f58" value="7f58"/>
    <field name="tcp.checksum.status" showname="Checksum Status: Unverified" size="0" pos="52" show="2"/>
    <field name="tcp.urgent_pointer" showname="Urgent pointer: 0" size="2" pos="54" show="0" value="0000"/>
    <field name="tcp.analysis" showname="SEQ/ACK analysis" size="0" pos="36" show="" value="">
      <field name="tcp.analysis.initial_rtt" showname="iRTT: 0.067216000 seconds" size="0" pos="36" show="0.067216000"/>
      <field name="tcp.analysis.bytes_in_flight" showname="Bytes in flight: 74" size="0" pos="36" show="74"/>
      <field name="tcp.analysis.push_bytes_sent" showname="Bytes sent since last PSH flag: 74" size="0" pos="36" show="74"/>
    </field>
    <field name="tcp.pdu.size" showname="PDU Size: 74" size="74" pos="56" show="74" value="0000004a02000000005310c03d04a12462373364613361332d343638322d343664662d393963622d333563336130356239636561a10c31302e31302e36322e3234347000040000600100"/>
  </proto>
  <proto name="amqp" showname="Advanced Message Queueing Protocol" size="74" pos="56">
    <field name="amqp.length" showname="Length: 74" size="4" pos="56" show="74" value="0000004a"/>
    <field name="amqp.doff" showname="Doff: 2" size="1" pos="60" show="2" value="02"/>
    <field name="amqp.type" showname="Type: AMQP (0)" size="1" pos="61" show="0" value="00"/>
    <field name="amqp.channel" showname="Channel: 0" size="2" pos="62" show="0" value="0000"/>
    <field name="amqp.performative" showname="Performative: open (16)" size="1" pos="66" show="16" value="10"/>
    <field name="amqp.method.arguments" showname="Arguments" size="63" pos="67" show="" value="">
      <field name="amqp.performative.arguments.containerId" showname="Container-Id: b73da3a3-4682-46df-99cb-35c3a05b9cea" size="36" pos="72" show="b73da3a3-4682-46df-99cb-35c3a05b9cea" value="62373364613361332d343638322d343664662d393963622d333563336130356239636561"/>
      <field name="amqp.performative.arguments.hostname" showname="Hostname: 10.10.62.244" size="12" pos="110" show="10.10.62.244" value="31302e31302e36322e323434"/>
      <field name="amqp.performative.arguments.maxFrameSize" showname="Max-Frame-Size: 262144" size="4" pos="123" show="262144" value="00040000"/>
      <field name="amqp.performative.arguments.channelMax" showname="Channel-Max: 256" size="2" pos="128" show="256" value="0100"/>
    </field>
  </proto>
</packet>


<packet>
  <proto name="geninfo" pos="0" showname="General information" size="91">
    <field name="num" pos="0" show="293" showname="Number" value="125" size="91"/>
    <field name="len" pos="0" show="91" showname="Frame Length" value="5b" size="91"/>
    <field name="caplen" pos="0" show="91" showname="Captured Length" value="5b" size="91"/>
    <field name="timestamp" pos="0" show="Oct  4, 2016 14:38:05.017478000 EDT" showname="Captured Time" value="1475606285.017478000" size="91"/>
  </proto>
  <proto name="frame" showname="Frame 293: 91 bytes on wire (728 bits), 91 bytes captured (728 bits) on interface 0" size="91" pos="0">
    <field name="frame.interface_id" showname="Interface id: 0 (any)" size="0" pos="0" show="0"/>
    <field name="frame.encap_type" showname="Encapsulation type: Linux cooked-mode capture (25)" size="0" pos="0" show="25"/>
    <field name="frame.time" showname="Arrival Time: Oct  4, 2016 14:38:05.017478000 EDT" size="0" pos="0" show="Oct  4, 2016 14:38:05.017478000 EDT"/>
    <field name="frame.offset_shift" showname="Time shift for this packet: 0.000000000 seconds" size="0" pos="0" show="0.000000000"/>
    <field name="frame.time_epoch" showname="Epoch Time: 1475606285.017478000 seconds" size="0" pos="0" show="1475606285.017478000"/>
    <field name="frame.time_delta" showname="Time delta from previous captured frame: 0.000029000 seconds" size="0" pos="0" show="0.000029000"/>
    <field name="frame.time_delta_displayed" showname="Time delta from previous displayed frame: 0.000109000 seconds" size="0" pos="0" show="0.000109000"/>
    <field name="frame.time_relative" showname="Time since reference or first frame: 4.227801000 seconds" size="0" pos="0" show="4.227801000"/>
    <field name="frame.number" showname="Frame Number: 293" size="0" pos="0" show="293"/>
    <field name="frame.len" showname="Frame Length: 91 bytes (728 bits)" size="0" pos="0" show="91"/>
    <field name="frame.cap_len" showname="Capture Length: 91 bytes (728 bits)" size="0" pos="0" show="91"/>
    <field name="frame.marked" showname="Frame is marked: False" size="0" pos="0" show="0"/>
    <field name="frame.ignored" showname="Frame is ignored: False" size="0" pos="0" show="0"/>
    <field name="frame.protocols" showname="Protocols in frame: sll:ethertype:ip:tcp:amqp" size="0" pos="0" show="sll:ethertype:ip:tcp:amqp"/>
  </proto>
  <proto name="sll" showname="Linux cooked capture" size="16" pos="0">
    <field name="sll.pkttype" showname="Packet type: Unicast to us (0)" size="2" pos="0" show="0" value="0000"/>
    <field name="sll.hatype" showname="Link-layer address type: 65534" size="2" pos="2" show="65534" value="fffe"/>
    <field name="sll.halen" showname="Link-layer address length: 0" size="2" pos="4" show="0" value="0000"/>
    <field name="sll.etype" showname="Protocol: IPv4 (0x0800)" size="2" pos="14" show="0x00000800" value="0800"/>
  </proto>
  <proto name="ip" showname="Internet Protocol Version 4, Src: 10.18.96.1, Dst: 10.10.62.244" size="20" pos="16">
    <field name="ip.version" showname="0100 .... = Version: 4" size="1" pos="16" show="4" value="4" unmaskedvalue="45"/>
    <field name="ip.hdr_len" showname=".... 0101 = Header Length: 20 bytes (5)" size="1" pos="16" show="20" value="45"/>
    <field name="ip.dsfield" showname="Differentiated Services Field: 0x00 (DSCP: CS0, ECN: Not-ECT)" size="1" pos="17" show="0x00000000" value="00">
      <field name="ip.dsfield.dscp" showname="0000 00.. = Differentiated Services Codepoint: Default (0)" size="1" pos="17" show="0" value="0" unmaskedvalue="00"/>
      <field name="ip.dsfield.ecn" showname=".... ..00 = Explicit Congestion Notification: Not ECN-Capable Transport (0)" size="1" pos="17" show="0" value="0" unmaskedvalue="00"/>
    </field>
    <field name="ip.len" showname="Total Length: 75" size="2" pos="18" show="75" value="004b"/>
    <field name="ip.id" showname="Identification: 0x6ac8 (27336)" size="2" pos="20" show="0x00006ac8" value="6ac8"/>
    <field name="ip.flags" showname="Flags: 0x02 (Don&#x27;t Fragment)" size="1" pos="22" show="0x00000002" value="40">
      <field name="ip.flags.rb" showname="0... .... = Reserved bit: Not set" size="1" pos="22" show="0" value="40"/>
      <field name="ip.flags.df" showname=".1.. .... = Don&#x27;t fragment: Set" size="1" pos="22" show="1" value="40"/>
      <field name="ip.flags.mf" showname="..0. .... = More fragments: Not set" size="1" pos="22" show="0" value="40"/>
    </field>
    <field name="ip.frag_offset" showname="Fragment offset: 0" size="2" pos="22" show="0" value="4000"/>
    <field name="ip.ttl" showname="Time to live: 124" size="1" pos="24" show="124" value="7c"/>
    <field name="ip.proto" showname="Protocol: TCP (6)" size="1" pos="25" show="6" value="06"/>
    <field name="ip.checksum" showname="Header checksum: 0xe0d3 [validation disabled]" size="2" pos="26" show="0x0000e0d3" value="e0d3"/>
    <field name="ip.checksum.status" showname="Header checksum status: Unverified" size="0" pos="26" show="2"/>
    <field name="ip.src" showname="Source: 10.18.96.1" size="4" pos="28" show="10.18.96.1" value="0a126001"/>
    <field name="ip.addr" showname="Source or Destination Address: 10.18.96.1" size="4" pos="28" show="10.18.96.1" value="0a126001"/>
    <field name="ip.src_host" showname="Source Host: 10.18.96.1" size="4" pos="28" show="10.18.96.1" value="0a126001"/>
    <field name="ip.host" showname="Source or Destination Host: 10.18.96.1" size="4" pos="28" show="10.18.96.1" value="0a126001"/>
    <field name="ip.dst" showname="Destination: 10.10.62.244" size="4" pos="32" show="10.10.62.244" value="0a0a3ef4"/>
    <field name="ip.addr" showname="Source or Destination Address: 10.10.62.244" size="4" pos="32" show="10.10.62.244" value="0a0a3ef4"/>
    <field name="ip.dst_host" showname="Destination Host: 10.10.62.244" size="4" pos="32" show="10.10.62.244" value="0a0a3ef4"/>
    <field name="ip.host" showname="Source or Destination Host: 10.10.62.244" size="4" pos="32" show="10.10.62.244" value="0a0a3ef4"/>
    <field name="" show="Source GeoIP: Unknown" size="4" pos="28" value="0a126001"/>
    <field name="" show="Destination GeoIP: Unknown" size="4" pos="32" value="0a0a3ef4"/>
  </proto>
  <proto name="tcp" showname="Transmission Control Protocol, Src Port: 57031, Dst Port: 5672, Seq: 83, Ack: 1, Len: 35" size="20" pos="36">
    <field name="tcp.srcport" showname="Source Port: 57031" size="2" pos="36" show="57031" value="dec7"/>
    <field name="tcp.dstport" showname="Destination Port: 5672" size="2" pos="38" show="5672" value="1628"/>
    <field name="tcp.port" showname="Source or Destination Port: 57031" size="2" pos="36" show="57031" value="dec7"/>
    <field name="tcp.port" showname="Source or Destination Port: 5672" size="2" pos="38" show="5672" value="1628"/>
    <field name="tcp.stream" showname="Stream index: 4" size="0" pos="36" show="4"/>
    <field name="tcp.len" showname="TCP Segment Len: 35" size="1" pos="48" show="35" value="50"/>
    <field name="tcp.seq" showname="Sequence number: 83    (relative sequence number)" size="4" pos="40" show="83" value="16fa0199"/>
    <field name="tcp.nxtseq" showname="Next sequence number: 118    (relative sequence number)" size="0" pos="36" show="118"/>
    <field name="tcp.ack" showname="Acknowledgment number: 1    (relative ack number)" size="4" pos="44" show="1" value="fcf2270e"/>
    <field name="tcp.hdr_len" showname="Header Length: 20 bytes" size="1" pos="48" show="20" value="50"/>
    <field name="tcp.flags" showname="Flags: 0x018 (PSH, ACK)" size="2" pos="48" show="0x00000018" value="18" unmaskedvalue="5018">
      <field name="tcp.flags.res" showname="000. .... .... = Reserved: Not set" size="1" pos="48" show="0" value="0" unmaskedvalue="50"/>
      <field name="tcp.flags.ns" showname="...0 .... .... = Nonce: Not set" size="1" pos="48" show="0" value="0" unmaskedvalue="50"/>
      <field name="tcp.flags.cwr" showname=".... 0... .... = Congestion Window Reduced (CWR): Not set" size="1" pos="49" show="0" value="0" unmaskedvalue="18"/>
      <field name="tcp.flags.ecn" showname=".... .0.. .... = ECN-Echo: Not set" size="1" pos="49" show="0" value="0" unmaskedvalue="18"/>
      <field name="tcp.flags.urg" showname=".... ..0. .... = Urgent: Not set" size="1" pos="49" show="0" value="0" unmaskedvalue="18"/>
      <field name="tcp.flags.ack" showname=".... ...1 .... = Acknowledgment: Set" size="1" pos="49" show="1" value="1" unmaskedvalue="18"/>
      <field name="tcp.flags.push" showname=".... .... 1... = Push: Set" size="1" pos="49" show="1" value="1" unmaskedvalue="18"/>
      <field name="tcp.flags.reset" showname=".... .... .0.. = Reset: Not set" size="1" pos="49" show="0" value="0" unmaskedvalue="18"/>
      <field name="tcp.flags.syn" showname=".... .... ..0. = Syn: Not set" size="1" pos="49" show="0" value="0" unmaskedvalue="18"/>
      <field name="tcp.flags.fin" showname=".... .... ...0 = Fin: Not set" size="1" pos="49" show="0" value="0" unmaskedvalue="18"/>
      <field name="tcp.flags.str" showname="TCP Flags: \xc2\xb7\xc2\xb7\xc2\xb7\xc2\xb7\xc2\xb7\xc2\xb7\xc2\xb7AP\xc2\xb7\xc2\xb7\xc2\xb7" size="2" pos="48" show="\xc2\xb7\xc2\xb7\xc2\xb7\xc2\xb7\xc2\xb7\xc2\xb7\xc2\xb7AP\xc2\xb7\xc2\xb7\xc2\xb7" value="5018"/>
    </field>
    <field name="tcp.window_size_value" showname="Window size value: 258" size="2" pos="50" show="258" value="0102"/>
    <field name="tcp.window_size" showname="Calculated window size: 66048" size="2" pos="50" show="66048" value="0102"/>
    <field name="tcp.window_size_scalefactor" showname="Window size scaling factor: 256" size="2" pos="50" show="256" value="0102"/>
    <field name="tcp.checksum" showname="Checksum: 0x76f0 [unverified]" size="2" pos="52" show="0x000076f0" value="76f0"/>
    <field name="tcp.checksum.status" showname="Checksum Status: Unverified" size="0" pos="52" show="2"/>
    <field name="tcp.urgent_pointer" showname="Urgent pointer: 0" size="2" pos="54" show="0" value="0000"/>
    <field name="tcp.analysis" showname="SEQ/ACK analysis" size="0" pos="36" show="" value="">
      <field name="tcp.analysis.initial_rtt" showname="iRTT: 0.067216000 seconds" size="0" pos="36" show="0.067216000"/>
      <field name="tcp.analysis.bytes_in_flight" showname="Bytes in flight: 35" size="0" pos="36" show="35"/>
      <field name="tcp.analysis.push_bytes_sent" showname="Bytes sent since last PSH flag: 35" size="0" pos="36" show="35"/>
    </field>
    <field name="tcp.pdu.size" showname="PDU Size: 35" size="35" pos="56" show="35" value="0000002302000000005311c016054070fffffffd7000000800700000080070ffffffff"/>
  </proto>
  <proto name="amqp" showname="Advanced Message Queueing Protocol" size="35" pos="56">
    <field name="amqp.length" showname="Length: 35" size="4" pos="56" show="35" value="00000023"/>
    <field name="amqp.doff" showname="Doff: 2" size="1" pos="60" show="2" value="02"/>
    <field name="amqp.type" showname="Type: AMQP (0)" size="1" pos="61" show="0" value="00"/>
    <field name="amqp.channel" showname="Channel: 0" size="2" pos="62" show="0" value="0000"/>
    <field name="amqp.performative" showname="Performative: begin (17)" size="1" pos="66" show="17" value="11"/>
    <field name="amqp.method.arguments" showname="Arguments" size="24" pos="67" show="" value="">
      <field name="amqp.performative.arguments.nextOutgoingId" showname="Next-Outgoing-Id: 4294967293" size="4" pos="72" show="4294967293" value="fffffffd"/>
      <field name="amqp.performative.arguments.incomingWindow" showname="Incoming-Window: 2048" size="4" pos="77" show="2048" value="00000800"/>
      <field name="amqp.performative.arguments.outgoingWindow" showname="Outgoing-Window: 2048" size="4" pos="82" show="2048" value="00000800"/>
      <field name="amqp.performative.arguments.handleMax" showname="Handle-Max: 4294967295" size="4" pos="87" show="4294967295" value="ffffffff"/>
    </field>
  </proto>
</packet>


<packet>
  <proto name="geninfo" pos="0" showname="General information" size="99">
    <field name="num" pos="0" show="297" showname="Number" value="129" size="99"/>
    <field name="len" pos="0" show="99" showname="Frame Length" value="63" size="99"/>
    <field name="caplen" pos="0" show="99" showname="Captured Length" value="63" size="99"/>
    <field name="timestamp" pos="0" show="Oct  4, 2016 14:38:05.022308000 EDT" showname="Captured Time" value="1475606285.022308000" size="99"/>
  </proto>
  <proto name="frame" showname="Frame 297: 99 bytes on wire (792 bits), 99 bytes captured (792 bits) on interface 0" size="99" pos="0">
    <field name="frame.interface_id" showname="Interface id: 0 (any)" size="0" pos="0" show="0"/>
    <field name="frame.encap_type" showname="Encapsulation type: Linux cooked-mode capture (25)" size="0" pos="0" show="25"/>
    <field name="frame.time" showname="Arrival Time: Oct  4, 2016 14:38:05.022308000 EDT" size="0" pos="0" show="Oct  4, 2016 14:38:05.022308000 EDT"/>
    <field name="frame.offset_shift" showname="Time shift for this packet: 0.000000000 seconds" size="0" pos="0" show="0.000000000"/>
    <field name="frame.time_epoch" showname="Epoch Time: 1475606285.022308000 seconds" size="0" pos="0" show="1475606285.022308000"/>
    <field name="frame.time_delta" showname="Time delta from previous captured frame: 0.000098000 seconds" size="0" pos="0" show="0.000098000"/>
    <field name="frame.time_delta_displayed" showname="Time delta from previous displayed frame: 0.004830000 seconds" size="0" pos="0" show="0.004830000"/>
    <field name="frame.time_relative" showname="Time since reference or first frame: 4.232631000 seconds" size="0" pos="0" show="4.232631000"/>
    <field name="frame.number" showname="Frame Number: 297" size="0" pos="0" show="297"/>
    <field name="frame.len" showname="Frame Length: 99 bytes (792 bits)" size="0" pos="0" show="99"/>
    <field name="frame.cap_len" showname="Capture Length: 99 bytes (792 bits)" size="0" pos="0" show="99"/>
    <field name="frame.marked" showname="Frame is marked: False" size="0" pos="0" show="0"/>
    <field name="frame.ignored" showname="Frame is ignored: False" size="0" pos="0" show="0"/>
    <field name="frame.protocols" showname="Protocols in frame: sll:ethertype:ip:tcp:amqp" size="0" pos="0" show="sll:ethertype:ip:tcp:amqp"/>
  </proto>
  <proto name="sll" showname="Linux cooked capture" size="16" pos="0">
    <field name="sll.pkttype" showname="Packet type: Unicast to us (0)" size="2" pos="0" show="0" value="0000"/>
    <field name="sll.hatype" showname="Link-layer address type: 65534" size="2" pos="2" show="65534" value="fffe"/>
    <field name="sll.halen" showname="Link-layer address length: 0" size="2" pos="4" show="0" value="0000"/>
    <field name="sll.etype" showname="Protocol: IPv4 (0x0800)" size="2" pos="14" show="0x00000800" value="0800"/>
  </proto>
  <proto name="ip" showname="Internet Protocol Version 4, Src: 10.18.96.1, Dst: 10.10.62.244" size="20" pos="16">
    <field name="ip.version" showname="0100 .... = Version: 4" size="1" pos="16" show="4" value="4" unmaskedvalue="45"/>
    <field name="ip.hdr_len" showname=".... 0101 = Header Length: 20 bytes (5)" size="1" pos="16" show="20" value="45"/>
    <field name="ip.dsfield" showname="Differentiated Services Field: 0x00 (DSCP: CS0, ECN: Not-ECT)" size="1" pos="17" show="0x00000000" value="00">
      <field name="ip.dsfield.dscp" showname="0000 00.. = Differentiated Services Codepoint: Default (0)" size="1" pos="17" show="0" value="0" unmaskedvalue="00"/>
      <field name="ip.dsfield.ecn" showname=".... ..00 = Explicit Congestion Notification: Not ECN-Capable Transport (0)" size="1" pos="17" show="0" value="0" unmaskedvalue="00"/>
    </field>
    <field name="ip.len" showname="Total Length: 83" size="2" pos="18" show="83" value="0053"/>
    <field name="ip.id" showname="Identification: 0x6ac9 (27337)" size="2" pos="20" show="0x00006ac9" value="6ac9"/>
    <field name="ip.flags" showname="Flags: 0x02 (Don&#x27;t Fragment)" size="1" pos="22" show="0x00000002" value="40">
      <field name="ip.flags.rb" showname="0... .... = Reserved bit: Not set" size="1" pos="22" show="0" value="40"/>
      <field name="ip.flags.df" showname=".1.. .... = Don&#x27;t fragment: Set" size="1" pos="22" show="1" value="40"/>
